gemm_config.in
batch_size, seq_len, head_num, size_per_head dataType ### batchCount, n, m, k, algoId, customOption, tile, numSplitsK, swizzle, reductionScheme, workspaceSize, stages, exec_time
1 4096 40 128 1 ### 1 15360 4096 5120 21 0 24 1 0 0 0 0 5.736591
1 4096 40 128 1 ### 40 4096 4096 128 103 -1 -1 -1 -1 -1 -1 -1 3.542430
1 4096 40 128 1 ### 40 128 4096 4096 112 -1 -1 -1 -1 -1 -1 -1 2.388300
1 4096 40 128 1 ### 1 5120 4096 5120 21 0 24 1 0 0 0 0 1.959486
1 4096 40 128 1 ### 1 13824 4096 5120 21 0 24 1 0 0 0 0 5.370512
1 4096 40 128 1 ### 1 5120 4096 13824 21 0 24 2 0 1 2560 0 5.317704
1 1 40 128 1 ### 1 15360 1 5120 3 0 21 11 0 4 307200 0 0.170936
1 1 40 128 1 ### 1 5120 1 5120 110 -1 -1 -1 -1 -1 -1 -1 0.069950
1 1 40 128 1 ### 1 13824 1 5120 3 0 21 11 0 4 276480 0 0.163369
1 1 40 128 1 ### 1 5120 1 13824 110 -1 -1 -1 -1 -1 -1 -1 0.166080
1 1 40 128 1 ### 1 32000 1 5120 99 -1 -1 -1 -1 -1 -1 -1 0.525550
2 4096 40 128 1 ### 1 15360 8192 5120 21 0 24 1 0 0 0 0 11.631278
2 4096 40 128 1 ### 80 4096 4096 128 111 -1 -1 -1 -1 -1 -1 -1 7.095170
2 4096 40 128 1 ### 80 128 4096 4096 112 -1 -1 -1 -1 -1 -1 -1 4.756290
2 4096 40 128 1 ### 1 5120 8192 5120 21 0 24 1 0 0 0 0 3.923117
2 4096 40 128 1 ### 1 13824 8192 5120 21 0 24 1 0 0 0 0 10.763080
2 4096 40 128 1 ### 1 5120 8192 13824 21 0 24 2 0 1 5120 0 10.619382
2 1 40 128 1 ### 1 15360 2 5120 21 0 18 2 0 1 480 0 0.164311
2 1 40 128 1 ### 1 5120 2 5120 110 -1 -1 -1 -1 -1 -1 -1 0.070040
2 1 40 128 1 ### 1 13824 2 5120 99 -1 -1 -1 -1 -1 -1 -1 0.148180
2 1 40 128 1 ### 1 5120 2 13824 99 -1 -1 -1 -1 -1 -1 -1 0.153850
2 1 40 128 1 ### 1 32000 2 5120 99 -1 -1 -1 -1 -1 -1 -1 0.527650
